{
  "brand_slug": "nishat",
  "scraped_at": "2026-07-12T18:50:03.525847+05:00",
  "currency": "PKR",
  "products": [
    {
      "external_id": "8699253358791",
      "title": "3 Piece - Printed Embroidered Suit - PS26-117",
      "product_url": "https://nishatlinen.com/products/ps26-117",
      "category": "ready to wear",
      "fabric": null,
      "tags": [
        "18%",
        "4-june-live-pret",
        "4-june-rtw-live",
        "6-july-pret-to",
        "9-july-pret-live",
        "9-july-rtw",
        "All-Mono-Edit-S'26",
        "all-pret-sum-2026",
        "all-sum-2026",
        "All-Whimsy-Edit-S'26",
        "bas-pret",
        "emb-pret",
        "new-in-all",
        "new-in-pret",
        "pret-3pc",
        "pret-best-sellers-sum-2026",
        "ready to wear",
        "rtw-july-2026",
        "rtw-june-2026",
        "RTW-Report-Summer-26",
        "rtw-sum-2026-vol-2",
        "rtw-whimsy-edit",
        "women"
      ],
      "images": [
        "https://cdn.shopify.com/s/files/1/0534/2065/4791/files/PS26-117-_3.jpg?v=1780299028",
        "https://cdn.shopify.com/s/files/1/0534/2065/4791/files/PS26-117-_1.jpg?v=1780299027",
        "https://cdn.shopify.com/s/files/1/0534/2065/4791/files/PS26-117-_10.jpg?v=1780299051",
        "https://cdn.shopify.com/s/files/1/0534/2065/4791/files/PS26-117-_2.jpg?v=1780299053",
        "https://cdn.shopify.com/s/files/1/0534/2065/4791/files/PS26-117-_12.jpg?v=1780299052",
        "https://cdn.shopify.com/s/files/1/0534/2065/4791/files/PS26-117-_7.jpg?v=1780299050"
      ],
      "variants": [
        {
          "external_id": "46508992921799",
          "title": "XS",
          "price": 15990.0,
          "compare_at_price": null,
          "available": true
        },
        {
          "external_id": "46508992954567",
          "title": "S",
          "price": 15990.0,
          "compare_at_price": null,
          "available": true
        },
        {
          "external_id": "46508992987335",
          "title": "M",
          "price": 15990.0,
          "compare_at_price": null,
          "available": true
        },
        {
          "external_id": "46508993020103",
          "title": "L",
          "price": 15990.0,
          "compare_at_price": null,
          "available": true
        },
        {
          "external_id": "46508993052871",
          "title": "XL",
          "price": 15990.0,
          "compare_at_price": null,
          "available": true
        }
      ]
    },
    {
      "external_id": "8757115617479",
      "title": "Green Women Scarf-447402104",
      "product_url": "https://nishatlinen.com/products/ys-mc-bx-9-s26-green",
      "category": "fashion",
      "fabric": null,
      "tags": [
        "9-July-Wraps",
        "accessories",
        "all-scarf",
        "all-sum-2026",
        "all-sum-scarf-2026",
        "All-Whimsy-Edit-S'26",
        "fashion",
        "Green",
        "import-No-1783324784870366",
        "new-in-accessories",
        "new-in-all",
        "Standard",
        "women scarf",
        "wraps"
      ],
      "images": [
        "https://cdn.shopify.com/s/files/1/0534/2065/4791/files/000447402104-_1.jpg?v=1783665542",
        "https://cdn.shopify.com/s/files/1/0534/2065/4791/files/000447402104-_2.jpg?v=1783665541",
        "https://cdn.shopify.com/s/files/1/0534/2065/4791/files/000447402104-_3.jpg?v=1783665542",
        "https://cdn.shopify.com/s/files/1/0534/2065/4791/files/000447402104-_4.jpg?v=1783665542",
        "https://cdn.shopify.com/s/files/1/0534/2065/4791/files/000447402104-_6.jpg?v=1783665542",
        "https://cdn.shopify.com/s/files/1/0534/2065/4791/files/000447402104.jpg?v=1783665542"
      ],
      "variants": [
        {
          "external_id": "46732815106247",
          "title": "Default Title",
          "price": 2990.0,
          "compare_at_price": null,
          "available": true
        }
      ]
    },
    {
      "external_id": "8757115322567",
      "title": "Grey Women Scarf-447382111",
      "product_url": "https://nishatlinen.com/products/ys-mc-bx-6-s26-grey",
      "category": "fashion",
      "fabric": null,
      "tags": [
        "9-July-Wraps",
        "accessories",
        "all-scarf",
        "all-sum-2026",
        "all-sum-scarf-2026",
        "All-Whimsy-Edit-S'26",
        "fashion",
        "Grey",
        "import-No-1783324784870366",
        "new-in-accessories",
        "new-in-all",
        "Standard",
        "women scarf",
        "wraps"
      ],
      "images": [
        "https://cdn.shopify.com/s/files/1/0534/2065/4791/files/000447382111-_2.jpg?v=1783665451",
        "https://cdn.shopify.com/s/files/1/0534/2065/4791/files/000447382111-_1.jpg?v=1783665451",
        "https://cdn.shopify.com/s/files/1/0534/2065/4791/files/000447382111-_4.jpg?v=1783665451",
        "https://cdn.shopify.com/s/files/1/0534/2065/4791/files/000447382111-_5.jpg?v=1783665451",
        "https://cdn.shopify.com/s/files/1/0534/2065/4791/files/000447382111-_6.jpg?v=1783665451"
      ],
      "variants": [
        {
          "external_id": "46732814811335",
          "title": "Default Title",
          "price": 2990.0,
          "compare_at_price": null,
          "available": true
        }
      ]
    },
    {
      "external_id": "8757115257031",
      "title": "Brown Women Scarf-447382113",
      "product_url": "https://nishatlinen.com/products/ys-mc-bx-6-s26-brown",
      "category": "fashion",
      "fabric": null,
      "tags": [
        "9-July-Wraps",
        "accessories",
        "all-scarf",
        "all-sum-2026",
        "all-sum-scarf-2026",
        "All-Whimsy-Edit-S'26",
        "Brown",
        "fashion",
        "import-No-1783324784870366",
        "new-in-accessories",
        "new-in-all",
        "Standard",
        "women scarf",
        "wraps"
      ],
      "images": [
        "https://cdn.shopify.com/s/files/1/0534/2065/4791/files/000447382113-_1.jpg?v=1783665500",
        "https://cdn.shopify.com/s/files/1/0534/2065/4791/files/000447382113-_2.jpg?v=1783665500",
        "https://cdn.shopify.com/s/files/1/0534/2065/4791/files/000447382113-_3.jpg?v=1783665500",
        "https://cdn.shopify.com/s/files/1/0534/2065/4791/files/000447382113-_4.jpg?v=1783665500",
        "https://cdn.shopify.com/s/files/1/0534/2065/4791/files/000447382113-_5.jpg?v=1783665500"
      ],
      "variants": [
        {
          "external_id": "46732814745799",
          "title": "Default Title",
          "price": 2990.0,
          "compare_at_price": null,
          "available": true
        }
      ]
    },
    {
      "external_id": "8757115060423",
      "title": "Pink Women Scarf-447372105",
      "product_url": "https://nishatlinen.com/products/ys-mc-bx-5-s26-pink",
      "category": "fashion",
      "fabric": null,
      "tags": [
        "9-July-Wraps",
        "accessories",
        "all-scarf",
        "all-sum-2026",
        "all-sum-scarf-2026",
        "All-Whimsy-Edit-S'26",
        "fashion",
        "import-No-1783324784870366",
        "new-in-accessories",
        "new-in-all",
        "Pink",
        "Standard",
        "women scarf",
        "wraps"
      ],
      "images": [
        "https://cdn.shopify.com/s/files/1/0534/2065/4791/files/000447372105-_1.jpg?v=1783665370",
        "https://cdn.shopify.com/s/files/1/0534/2065/4791/files/000447372105-_2.jpg?v=1783665370",
        "https://cdn.shopify.com/s/files/1/0534/2065/4791/files/000447372105-_3.jpg?v=1783665370",
        "https://cdn.shopify.com/s/files/1/0534/2065/4791/files/000447372105-_4.jpg?v=1783665370",
        "https://cdn.shopify.com/s/files/1/0534/2065/4791/files/000447372105-_5.jpg?v=1783665370"
      ],
      "variants": [
        {
          "external_id": "46732814352583",
          "title": "Default Title",
          "price": 3490.0,
          "compare_at_price": null,
          "available": true
        }
      ]
    }
  ]
}